{
  "witness_id": "w_quaest_2026-08-03_g1_2t",
  "poll_id": "quaest_2026-08-03_stimulated_2nd_round_flavio_bolsonaro_vs_lula",
  "source_type": "press",
  "source_url": "https://g1.globo.com/politica/eleicoes/2026/pesquisa-eleitoral/noticia/2026/08/05/quaest-2o-turno-lula-flavio-bolsonaro-agosto-2026.ghtml",
  "retrieved_at": "2026-09-27T02:35:00Z",
  "content_hash": "sha256:25e9ebfe6d8253c55ebdd0005337b63048cc01df12fed8417be173fdd5aab799",
  "raw_path": null,
  "parser_id": "manual_intake_cohort_2t_003_v1",
  "extractions": {
    "fieldwork": "2026-07-31..2026-08-03",
    "n": 2004,
    "moe_pp": 2,
    "tse": "BR-06591/2026",
    "matchups_extracted": 4,
    "headline_scenario": "stimulated_2nd_round_flavio_bolsonaro_vs_lula"
  },
  "confidence": 0.92,
  "tse_registration_id": "BR-06591/2026",
  "notes": "Fetched HTML 2026-09-26 (America/Sao_Paulo). 4 stimulated 2º matchups from content-unordered-list. No Cury 2º. Fieldwork 31 Jul–3 Aug; TSE BR-06591/2026."
}
