{
  "witness_id": "w_quaest_2026-08-03_gazeta",
  "poll_id": "quaest_2026-08-03_stimulated_1st_round",
  "source_type": "press",
  "source_url": "https://www.gazetadopovo.com.br/eleicoes/2026/pesquisa-eleitoral-2026/genial-quaest-presidente-agosto-2026/",
  "retrieved_at": "2026-09-27T00:05:00Z",
  "content_hash": "sha256:ea5a5e8634220ccef055a620c6330a8d89c373bdc39c8de74a40aaa193af6d8a",
  "raw_path": null,
  "parser_id": "manual_intake_cohort_003_v1",
  "extractions": {
    "n": 2004,
    "moe_pp": 2.0,
    "tse": "BR-06591/2026"
  },
  "confidence": 0.92,
  "tse_registration_id": "BR-06591/2026",
  "notes": "Fetched HTML with full stimulated table including residuals."
}
