{
  "witness_id": "w_nexus_2026-08-23_pdf",
  "poll_id": "nexus_2026-08-23_stimulated_1st_round",
  "source_type": "pdf",
  "source_url": "https://www.cartacapital.com.br/wp-content/uploads/2026/08/BTG-Nexus-Elei%C3%A7%C3%B5es-2026-Rodada-11-vers%C3%A3o-executiva-24.ago_.2026.pdf",
  "confidence": 0.95,
  "tse_registration_id": "BR-09028/2026",
  "extractions": {
    "n": 2006,
    "tse": "BR-09028/2026",
    "campo": "2026-08-21..2026-08-23",
    "slate": "cenario_1"
  },
  "notes": "",
  "content_hash": "sha256:6b18234a0a38182ef4d5cf805184f3f50315f4dee148a04762d67f07be5ab523",
  "retrieved_at": "2026-09-27T01:00:00Z",
  "parser_id": "manual_intake_cohort_007_v1",
  "raw_path": null
}
