{
  "witness_id": "w_nexus_2026-08-30_html",
  "poll_id": "nexus_2026-08-30_stimulated_1st_round",
  "source_type": "institute_release",
  "source_url": "https://www.nexus.fsb.com.br/estudos-divulgados/pesquisa-btg-nexus-de-intencao-de-votos-para-presidente-do-brasil-31-de-agosto-de-2026/",
  "retrieved_at": "2026-09-26T23:40:00Z",
  "content_hash": "sha256:2bb88110b35141b9f8dc8f56714cdd3a9ca7712a2148431c7bd6b2cdba940d48",
  "raw_path": null,
  "parser_id": "manual_intake_cohort_001_v1",
  "extractions": {
    "n": 2005,
    "moe_pp": 2,
    "tse": "BR-08900/2026",
    "round": "12"
  },
  "confidence": 0.93,
  "tse_registration_id": "BR-08900/2026",
  "notes": "Institute release page; stimulated 1º turno principal scenario."
}
