{
  "witness_id": "w_datafolha_2026-08-20_g1_2t",
  "poll_id": "datafolha_2026-08-20_stimulated_2nd_round_flavio_bolsonaro_vs_lula",
  "source_type": "press",
  "source_url": "https://g1.globo.com/politica/eleicoes/2026/pesquisa-eleitoral/noticia/2026/08/21/datafolha-segundo-turno-21-agosto.ghtml",
  "retrieved_at": "2026-09-27T02:26:00Z",
  "content_hash": "sha256:674ebb5b1e6e173d2c2bc5576acee751030432d0224973bf258cb6eb571d5a46",
  "raw_path": null,
  "parser_id": "manual_intake_cohort_2t_002_v1",
  "extractions": {
    "fieldwork": "2026-08-18..2026-08-20",
    "n": 2058,
    "moe_pp": 2,
    "tse": "BR-04496/2026",
    "matchups_extracted": 4,
    "headline_scenario": "stimulated_2nd_round_flavio_bolsonaro_vs_lula"
  },
  "confidence": 0.92,
  "tse_registration_id": "BR-04496/2026",
  "notes": "Fetched HTML 2026-09-26 (America/Sao_Paulo). One article covers 4 stimulated 2º-turno matchups; sibling polls also list this witness_id. Numbers from content-unordered-list. No Cury 2º scenario in this wave."
}
